{"$schema":"https://json-schema.org/draft/2020-12/schema","type":"object","required":["batch_id","created_at","tool_version","source_ids","input_checksums","files_created","files_modified","lifecycle_target","object_counts","validation_results","rollback_plan"],"properties":{"batch_id":{"type":"string","pattern":"^batch_sha256_[0-9a-f]{12}$"},"created_at":{"type":"string","format":"date-time"},"tool_version":{"type":"string"},"source_ids":{"type":"array","minItems":1,"items":{"type":"string"}},"input_checksums":{"type":"object","additionalProperties":{"type":"string","pattern":"^[0-9a-f]{64}$"}},"files_created":{"type":"array","items":{"type":"string"}},"files_modified":{"type":"array","items":{"type":"string"}},"lifecycle_target":{"type":"string"},"object_counts":{"type":"object"},"validation_results":{"type":"object"},"rollback_plan":{"type":"object"}},"additionalProperties":false}
